{"schema":"bullet.assurance-inventory.v1","authority":"planning-and-component-inventory-only","evidence_classes":["DESIGNED","COMPONENT","TRANSACTION","LIVE","RELEASE"],"follow_on_phases":["POST_V1","RETIRED"],"source_contracts":{"family_manifest":{"scope":"family-root","path":"repos.manifest.toml","schema":"1.2.0"},"corpus":{"scope":"hub","path":"policy/corpus-coverage-v1.json","schema":"bullet-farm.corpus-coverage.v1"},"invariants":{"scope":"hub","path":"policy/v1alpha1/invariant-registry.json","schema":"v1alpha1"},"receipt_kinds":{"scope":"hub","path":"contracts/v1alpha1/schema-bundle.json","schema":"v1alpha1"},"inventory_schema":{"scope":"hub","path":"docs/schemas/bullet.assurance-inventory.v1.schema.json","schema":"2020-12"}},"corpus_roles":{"spec":"historical-provenance","git_role":"historical-provenance","gastown":"historical-provenance","nightshift":"historical-provenance","potential":"historical-provenance","paper":"analysis-source","evo":"design-source"},"gaps":[{"id":"G1","waves":["W0","W1","W7"],"evidence_class":"DESIGNED"},{"id":"G2","waves":["W2","W3","W4","W5","W6","W7"],"evidence_class":"DESIGNED"},{"id":"G3","waves":["W2","W3"],"evidence_class":"DESIGNED"},{"id":"G4","waves":["W1","W4"],"evidence_class":"DESIGNED","indirect_gate":"release.transaction-demo"},{"id":"G5","waves":["W1","W8","W10"],"evidence_class":"DESIGNED"},{"id":"G6","waves":["W4","W5","W8"],"evidence_class":"DESIGNED"},{"id":"G7","waves":["W5","W10"],"evidence_class":"DESIGNED"},{"id":"G8","waves":["W3","W7"],"evidence_class":"DESIGNED"},{"id":"G9","waves":["W7","W10"],"evidence_class":"DESIGNED"},{"id":"G10","waves":["W3","W10"],"evidence_class":"DESIGNED"},{"id":"G11","waves":["W9"],"evidence_class":"DESIGNED"},{"id":"G12","waves":["W1","W7","W8"],"evidence_class":"DESIGNED"},{"id":"G13","waves":["W6","W9"],"evidence_class":"DESIGNED"},{"id":"G14","waves":["W2","W5","W6"],"evidence_class":"DESIGNED"},{"id":"G15","waves":["W9"],"evidence_class":"DESIGNED"},{"id":"G16","waves":["W4","W5","W10"],"evidence_class":"DESIGNED"},{"id":"G17","waves":["W11"],"evidence_class":"DESIGNED"},{"id":"G18","waves":["W11"],"evidence_class":"DESIGNED"}],"waves":[{"id":"W0","depends_on":[],"gaps":["G1"],"slices":["V1-S0"],"work_packages":["WP-01","WP-04","WP-11","WP-20","WP-22"],"evidence_class":"DESIGNED"},{"id":"W1","depends_on":["W0"],"gaps":["G1","G4","G5","G12"],"slices":["V1-S1"],"work_packages":["WP-01","WP-03","WP-07","WP-19","WP-22"],"evidence_class":"DESIGNED"},{"id":"W2","depends_on":["W1"],"gaps":["G2","G3","G14"],"slices":["V1-S2","V1-S4"],"work_packages":["WP-02","WP-16"],"evidence_class":"DESIGNED"},{"id":"W3","depends_on":["W2"],"gaps":["G2","G3","G8","G10"],"slices":[],"work_packages":["WP-02","WP-12","WP-21"],"evidence_class":"DESIGNED"},{"id":"W4","depends_on":["W3"],"gaps":["G2","G4","G6","G16"],"slices":["V1-S3"],"work_packages":["WP-02","WP-04","WP-05","WP-06","WP-16"],"evidence_class":"DESIGNED"},{"id":"W5","depends_on":["W4"],"gaps":["G2","G6","G7","G14","G16"],"slices":["V1-S4"],"work_packages":["WP-02","WP-05","WP-06"],"evidence_class":"DESIGNED"},{"id":"W6","depends_on":["W5"],"gaps":["G2","G13","G14"],"slices":["V1-S5"],"work_packages":["WP-02"],"evidence_class":"DESIGNED"},{"id":"W7","depends_on":["W6"],"gaps":["G1","G2","G8","G9","G12"],"slices":["V1-S7"],"work_packages":["WP-01","WP-02","WP-04","WP-05","WP-11","WP-13","WP-14","WP-19","WP-22","WP-23"],"evidence_class":"DESIGNED"},{"id":"W8","depends_on":["W7"],"gaps":["G5","G6","G12"],"slices":["V1-S6","V1-S8"],"work_packages":["WP-06","WP-07","WP-08","WP-12","WP-17","WP-19","WP-21","WP-22","WP-23"],"evidence_class":"DESIGNED"},{"id":"W9","depends_on":["W8"],"gaps":["G11","G13","G15"],"slices":["V1-S6"],"work_packages":["WP-15"],"evidence_class":"DESIGNED"},{"id":"W10","depends_on":["W8"],"gaps":["G5","G7","G9","G10","G16"],"slices":["V1-S8"],"work_packages":["WP-06","WP-09","WP-12","WP-15","WP-17","WP-21","WP-23"],"evidence_class":"DESIGNED"},{"id":"W11","depends_on":["W8"],"gaps":["G17","G18"],"slices":[],"work_packages":[],"evidence_class":"DESIGNED"}],"slices":[{"id":"V1-S0","waves":["W0"],"evidence_class":"COMPONENT"},{"id":"V1-S1","waves":["W1"],"evidence_class":"DESIGNED"},{"id":"V1-S2","waves":["W2"],"evidence_class":"DESIGNED"},{"id":"V1-S3","waves":["W4"],"evidence_class":"DESIGNED"},{"id":"V1-S4","waves":["W2","W5"],"evidence_class":"DESIGNED"},{"id":"V1-S5","waves":["W6"],"evidence_class":"DESIGNED"},{"id":"V1-S6","waves":["W8","W9"],"evidence_class":"DESIGNED"},{"id":"V1-S7","waves":["W7"],"evidence_class":"DESIGNED"},{"id":"V1-S8","waves":["W8","W10"],"evidence_class":"DESIGNED"}],"work_packages":[{"id":"WP-01","lifecycle":"ACTIVE","waves":["W0","W1","W7"],"follow_on":[],"owner":"hub-assurance","evidence_class":"DESIGNED"},{"id":"WP-02","lifecycle":"ACTIVE","waves":["W2","W3","W4","W5","W6","W7"],"follow_on":[],"owner":"transaction-family","evidence_class":"COMPONENT"},{"id":"WP-03","lifecycle":"ACTIVE","waves":["W1"],"follow_on":[],"owner":"shared-wire","evidence_class":"DESIGNED"},{"id":"WP-04","lifecycle":"ACTIVE","waves":["W0","W4","W7"],"follow_on":[],"owner":"hub-bulletgit","evidence_class":"DESIGNED"},{"id":"WP-05","lifecycle":"ACTIVE","waves":["W4","W5","W7"],"follow_on":[],"owner":"bulletgit-verifier-effects","evidence_class":"DESIGNED"},{"id":"WP-06","lifecycle":"ACTIVE","waves":["W4","W5","W8","W10"],"follow_on":[],"owner":"effects-forges","evidence_class":"DESIGNED"},{"id":"WP-07","lifecycle":"ACTIVE","waves":["W1","W8"],"follow_on":[],"owner":"jeryu-governance","evidence_class":"DESIGNED"},{"id":"WP-08","lifecycle":"ACTIVE","waves":["W8"],"follow_on":[],"owner":"jeryu-operations","evidence_class":"DESIGNED"},{"id":"WP-09","lifecycle":"ACTIVE","waves":["W10"],"follow_on":["POST_V1"],"owner":"jeryu-mirror-broker","evidence_class":"DESIGNED"},{"id":"WP-10","lifecycle":"ACTIVE","waves":[],"follow_on":["POST_V1"],"owner":"jankurai-governance","evidence_class":"DESIGNED"},{"id":"WP-11","lifecycle":"ACTIVE","waves":["W0","W7"],"follow_on":[],"owner":"hub-assurance","evidence_class":"DESIGNED"},{"id":"WP-12","lifecycle":"ACTIVE","waves":["W3","W8","W10"],"follow_on":[],"owner":"providers-effects","evidence_class":"DESIGNED"},{"id":"WP-13","lifecycle":"ACTIVE","waves":["W7"],"follow_on":[],"owner":"release-engineering","evidence_class":"DESIGNED"},{"id":"WP-14","lifecycle":"ACTIVE","waves":["W7"],"follow_on":[],"owner":"hub-documentation","evidence_class":"DESIGNED"},{"id":"WP-15","lifecycle":"ACTIVE","waves":["W9","W10"],"follow_on":[],"owner":"research-evaluation","evidence_class":"DESIGNED"},{"id":"WP-16","lifecycle":"ACTIVE","waves":["W2","W4"],"follow_on":[],"owner":"kernel-bulletgit","evidence_class":"DESIGNED"},{"id":"WP-17","lifecycle":"ACTIVE","waves":["W8","W10"],"follow_on":["POST_V1"],"owner":"jeryu-hub","evidence_class":"DESIGNED"},{"id":"WP-18","lifecycle":"RETIRED","waves":[],"follow_on":["RETIRED"],"owner":"jeryu-governance","evidence_class":"DESIGNED"},{"id":"WP-19","lifecycle":"ACTIVE","waves":["W1","W7","W8"],"follow_on":[],"owner":"hub-jeryu","evidence_class":"DESIGNED"},{"id":"WP-20","lifecycle":"ACTIVE","waves":["W0"],"follow_on":[],"owner":"hub-documentation-ci","evidence_class":"COMPONENT"},{"id":"WP-21","lifecycle":"ACTIVE","waves":["W3","W8","W10"],"follow_on":[],"owner":"runner-providers-hub","evidence_class":"DESIGNED"},{"id":"WP-22","lifecycle":"ACTIVE","waves":["W0","W1","W7","W8"],"follow_on":[],"owner":"ci-release-operations","evidence_class":"COMPONENT"},{"id":"WP-23","lifecycle":"ACTIVE","waves":["W7","W8","W10"],"follow_on":[],"owner":"hub-release-providers","evidence_class":"DESIGNED"}],"release_profiles":[{"name":"self-hosted-v1","kind":"product","condition_gate":"release.profile.self-hosted-v1","current_result":"BLOCKED"},{"name":"evolution-v1","kind":"product","condition_gate":"release.profile.evolution-v1","current_result":"BLOCKED"},{"name":"provider-claude","kind":"product","condition_gate":"release.profile.provider-claude","current_result":"BLOCKED"},{"name":"provider-codex","kind":"product","condition_gate":"release.profile.provider-codex","current_result":"BLOCKED"},{"name":"provider-cursor","kind":"product","condition_gate":"release.profile.provider-cursor","current_result":"BLOCKED"},{"name":"provider-antigravity","kind":"product","condition_gate":"release.profile.provider-antigravity","current_result":"BLOCKED"},{"name":"jeryu-forge-v1","kind":"product","condition_gate":"release.profile.jeryu-forge-v1","current_result":"BLOCKED"},{"name":"github-adapter-v1","kind":"product","condition_gate":"release.profile.github-adapter-v1","current_result":"BLOCKED"},{"name":"gitlab-adapter-v1","kind":"product","condition_gate":"release.profile.gitlab-adapter-v1","current_result":"BLOCKED"},{"name":"gitlab-self-managed-v1","kind":"product","condition_gate":"release.profile.gitlab-self-managed-v1","current_result":"BLOCKED"},{"name":"platform-linux-x86_64","kind":"product","condition_gate":"release.profile.platform-linux-x86_64","current_result":"BLOCKED"},{"name":"platform-linux-aarch64","kind":"product","condition_gate":"release.profile.platform-linux-aarch64","current_result":"BLOCKED"},{"name":"platform-macos-x86_64","kind":"product","condition_gate":"release.profile.platform-macos-x86_64","current_result":"BLOCKED"},{"name":"platform-macos-aarch64","kind":"product","condition_gate":"release.profile.platform-macos-aarch64","current_result":"BLOCKED"},{"name":"platform-windows-x86_64","kind":"product","condition_gate":"release.profile.platform-windows-x86_64","current_result":"BLOCKED"},{"name":"universal-v1","kind":"product","condition_gate":"release.profile.universal-v1","current_result":"BLOCKED"},{"name":"team-v1","kind":"product","condition_gate":"release.profile.team-v1","current_result":"BLOCKED"},{"name":"saga-v1","kind":"product","condition_gate":"release.profile.saga-v1","current_result":"BLOCKED"},{"name":"legacy-v1-26","kind":"diagnostic","condition_gate":null,"current_result":"BLOCKED"},{"name":"lin